{
    "projectName": "8-Bit Game Bot",
    "projectDate": "2023-01-12",
    "projectStatus": "abandoned",
    "projectTags": [
        "python",
        "html",
        "website",
        "discord bot",
        "game"
    ],
    "projectLink": "https://github.com/aaguy-hue/8-Bit",
    "coolness": 100
}